{
  "schemaVersion": "chromalab.benchmark.report_claims.v1",
  "caseId": "phase9j_bench_05_tic_plus_ions_model_enabled",
  "runId": "bench_05_tic_plus_ions_20260526_185451",
  "reportGate": "BLOCKED",
  "claims": [
    {
      "claimId": "claim_graph_count",
      "claimType": "graph_count",
      "status": "MISSING_EVIDENCE",
      "evidenceRefs": [
        "phase9j_summary.bench_05_tic_plus_ions.model_enabled.graph_count"
      ],
      "forbiddenSourceAccepted": false,
      "reason": "TIC+ions layout not propagated and Y calibration direction is inconsistent."
    },
    {
      "claimId": "claim_calibration",
      "claimType": "calibration",
      "status": "MISSING_EVIDENCE",
      "evidenceRefs": [
        "phase9j_summary.bench_05_tic_plus_ions.model_enabled.calibration"
      ],
      "forbiddenSourceAccepted": false,
      "reason": "TIC+ions layout not propagated and Y calibration direction is inconsistent."
    },
    {
      "claimId": "claim_trace_present",
      "claimType": "trace_present",
      "status": "MISSING_EVIDENCE",
      "evidenceRefs": [
        "phase9j_summary.bench_05_tic_plus_ions.model_enabled.trace_present"
      ],
      "forbiddenSourceAccepted": false,
      "reason": "TIC+ions layout not propagated and Y calibration direction is inconsistent."
    },
    {
      "claimId": "claim_peak_count",
      "claimType": "peak_count",
      "status": "MISSING_EVIDENCE",
      "evidenceRefs": [
        "phase9j_summary.bench_05_tic_plus_ions.model_enabled.peak_count"
      ],
      "forbiddenSourceAccepted": false,
      "reason": "TIC+ions layout not propagated and Y calibration direction is inconsistent."
    },
    {
      "claimId": "claim_peak_area",
      "claimType": "peak_area",
      "status": "MISSING_EVIDENCE",
      "evidenceRefs": [
        "phase9j_summary.bench_05_tic_plus_ions.model_enabled.peak_area"
      ],
      "forbiddenSourceAccepted": false,
      "reason": "TIC+ions layout not propagated and Y calibration direction is inconsistent."
    }
  ],
  "blockedClaimReasons": [
    "CALIBRATION_FAILURE"
  ]
}
