{
  "schemaVersion": "chromalab.benchmark.report_claims.v1",
  "caseId": "phase9j_bench_03_small_tic_export_deterministic",
  "runId": "bench_03_small_tic_export_20260526_184951",
  "reportGate": "REVIEW_ONLY",
  "claims": [
    {
      "claimId": "claim_graph_count",
      "claimType": "graph_count",
      "status": "SUPPORTED",
      "evidenceRefs": [
        "phase9j_summary.bench_03_small_tic_export.deterministic.graph_count"
      ],
      "forbiddenSourceAccepted": false,
      "reason": "Produces report/peaks but evidence gate remains review-grade; not release-ready."
    },
    {
      "claimId": "claim_calibration",
      "claimType": "calibration",
      "status": "REVIEW",
      "evidenceRefs": [
        "phase9j_summary.bench_03_small_tic_export.deterministic.calibration"
      ],
      "forbiddenSourceAccepted": false,
      "reason": "Produces report/peaks but evidence gate remains review-grade; not release-ready."
    },
    {
      "claimId": "claim_trace_present",
      "claimType": "trace_present",
      "status": "REVIEW",
      "evidenceRefs": [
        "phase9j_summary.bench_03_small_tic_export.deterministic.trace_present"
      ],
      "forbiddenSourceAccepted": false,
      "reason": "Produces report/peaks but evidence gate remains review-grade; not release-ready."
    },
    {
      "claimId": "claim_peak_count",
      "claimType": "peak_count",
      "status": "REVIEW",
      "evidenceRefs": [
        "phase9j_summary.bench_03_small_tic_export.deterministic.peak_count"
      ],
      "forbiddenSourceAccepted": false,
      "reason": "Produces report/peaks but evidence gate remains review-grade; not release-ready."
    },
    {
      "claimId": "claim_peak_area",
      "claimType": "peak_area",
      "status": "REVIEW",
      "evidenceRefs": [
        "phase9j_summary.bench_03_small_tic_export.deterministic.peak_area"
      ],
      "forbiddenSourceAccepted": false,
      "reason": "Produces report/peaks but evidence gate remains review-grade; not release-ready."
    }
  ],
  "blockedClaimReasons": [
    "PEAK_EVIDENCE_FAILURE"
  ]
}
